{
  "schema": "microfield-publication-benchmark-manifest-v1",
  "campaign_id": "pre-rc-b2-smoke-v1",
  "profile": "smoke",
  "seed": 7640891576956012809,
  "host_mode": "ci-shared",
  "minimum_processes": 2,
  "maximum_processes": 2,
  "precision_check_every": 1,
  "warmup_observations": 3,
  "measured_observations": 5,
  "target_observation_ns": 100000,
  "maximum_batch_iterations": 65536,
  "bootstrap_resamples": 500,
  "maximum_relative_ci_half_width": 0.5,
  "cells": [
    { "id": "field-gf2-128-mul", "family": "finite-field", "operation": "field.gf2-128.mul", "scale": 1, "scale_unit": "field-operation" },
    { "id": "field-gf2-256-hh-mul", "family": "finite-field", "operation": "field.gf2-256-hh.mul", "scale": 1, "scale_unit": "field-operation" },
    { "id": "field-gf2-256-alt-mul", "family": "finite-field", "operation": "field.gf2-256-alt.mul", "scale": 1, "scale_unit": "field-operation" },
    { "id": "field-fp251-mul", "family": "finite-field", "operation": "field.fp251.mul", "scale": 1, "scale_unit": "field-operation" },
    { "id": "field-goldilocks-mul", "family": "finite-field", "operation": "field.goldilocks.mul", "scale": 1, "scale_unit": "field-operation" },
    { "id": "field-gf2-128-batch-512", "family": "finite-field", "operation": "field.gf2-128.batch-detected", "scale": 512, "scale_unit": "field-elements", "baseline_cell": "field-gf2-128-mul" },
    { "id": "signature-additive-build-256", "family": "homomorphic-signature", "operation": "signature.additive.build", "scale": 256, "scale_unit": "items", "payload_bytes": 16 },
    { "id": "signature-sequence-build-256", "family": "homomorphic-signature", "operation": "signature.sequence.build", "scale": 256, "scale_unit": "items", "payload_bytes": 16 },
    { "id": "signature-bidirectional-build-256", "family": "homomorphic-signature", "operation": "signature.bidirectional.build", "scale": 256, "scale_unit": "items", "payload_bytes": 16 },
    { "id": "signature-multiset-build-256", "family": "homomorphic-signature", "operation": "signature.multiset.build", "scale": 256, "scale_unit": "items", "payload_bytes": 16 },
    { "id": "signature-multi-multiset-k2-build-256", "family": "homomorphic-signature", "operation": "signature.multi-multiset-k2.build", "scale": 256, "scale_unit": "items", "payload_bytes": 16 },
    { "id": "signature-multi-sequence-k2-build-256", "family": "homomorphic-signature", "operation": "signature.multi-sequence-k2.build", "scale": 256, "scale_unit": "items", "payload_bytes": 16 },
    { "id": "delta-additive-end-to-end-32", "family": "delta", "operation": "delta.additive.end-to-end", "scale": 32, "scale_unit": "items", "payload_bytes": 16 },
    { "id": "summary-tree-rebuild-16384", "family": "summary-tree", "operation": "summary-tree.rebuild", "scale": 16384, "scale_unit": "file-bytes" },
    { "id": "database-rebuild-128", "family": "database", "operation": "database.rebuild", "scale": 128, "scale_unit": "rows" },
    { "id": "reconciliation-decode-8", "family": "reconciliation", "operation": "reconciliation.decode", "scale": 8, "scale_unit": "symmetric-difference" },
    { "id": "graph-fast-prepared-256", "family": "graph", "operation": "graph.fast-prepared", "scale": 256, "scale_unit": "vertices" },
    { "id": "graph-exact-8", "family": "graph", "operation": "graph.exact", "scale": 8, "scale_unit": "vertices" },
    { "id": "graph-dag-reuse-8", "family": "graph", "operation": "graph.dag-reuse", "scale": 8, "scale_unit": "vertices", "baseline_cell": "graph-exact-8" },
    { "id": "tool-binary-manifest-parse", "family": "tooling", "operation": "tool.binary-manifest.parse", "scale": 1, "scale_unit": "manifest" },
    { "id": "tool-binary-manifest-generate", "family": "tooling", "operation": "tool.binary-manifest.generate", "scale": 1, "scale_unit": "generated-package" }
  ]
}
