{
  "schema": "microfield-publication-benchmark-manifest-v1",
  "campaign_id": "pre-rc-comprehensive-fragmentation-pilot-v3",
  "profile": "pilot",
  "seed": 15111065706836454659,
  "host_mode": "interactive",
  "minimum_processes": 10,
  "maximum_processes": 10,
  "precision_check_every": 5,
  "warmup_observations": 5,
  "measured_observations": 15,
  "target_observation_ns": 500000,
  "maximum_batch_iterations": 262144,
  "bootstrap_resamples": 1000,
  "maximum_relative_ci_half_width": 0.10,
  "cells": [
    {"id":"set-k4-fragments-256","family":"homomorphic-signature","operation":"signature.multi-multiset-k4.fragmented-merge-total","scale":256,"scale_unit":"fragments","dataset_size":65536,"payload_bytes":16,"curve":"set-k4-fragmentation","strategy":"alternating"},
    {"id":"set-k4-fragments-2","family":"homomorphic-signature","operation":"signature.multi-multiset-k4.fragmented-merge-total","scale":2,"scale_unit":"fragments","dataset_size":65536,"payload_bytes":16,"curve":"set-k4-fragmentation","strategy":"alternating"},
    {"id":"set-k4-fragments-8","family":"homomorphic-signature","operation":"signature.multi-multiset-k4.fragmented-merge-total","scale":8,"scale_unit":"fragments","dataset_size":65536,"payload_bytes":16,"curve":"set-k4-fragmentation","strategy":"alternating"},
    {"id":"set-k4-fragments-64","family":"homomorphic-signature","operation":"signature.multi-multiset-k4.fragmented-merge-total","scale":64,"scale_unit":"fragments","dataset_size":65536,"payload_bytes":16,"curve":"set-k4-fragmentation","strategy":"alternating"},
    {"id":"set-k4-fragments-1024","family":"homomorphic-signature","operation":"signature.multi-multiset-k4.fragmented-merge-total","scale":1024,"scale_unit":"fragments","dataset_size":65536,"payload_bytes":16,"curve":"set-k4-fragmentation","strategy":"alternating"},
    {"id":"seq-k4-fragments-256","family":"homomorphic-signature","operation":"signature.multi-sequence-k4.fragmented-concatenate-total","scale":256,"scale_unit":"fragments","dataset_size":65536,"payload_bytes":16,"curve":"seq-k4-fragmentation","strategy":"alternating"},
    {"id":"seq-k4-fragments-2","family":"homomorphic-signature","operation":"signature.multi-sequence-k4.fragmented-concatenate-total","scale":2,"scale_unit":"fragments","dataset_size":65536,"payload_bytes":16,"curve":"seq-k4-fragmentation","strategy":"alternating"},
    {"id":"seq-k4-fragments-8","family":"homomorphic-signature","operation":"signature.multi-sequence-k4.fragmented-concatenate-total","scale":8,"scale_unit":"fragments","dataset_size":65536,"payload_bytes":16,"curve":"seq-k4-fragmentation","strategy":"alternating"},
    {"id":"seq-k4-fragments-64","family":"homomorphic-signature","operation":"signature.multi-sequence-k4.fragmented-concatenate-total","scale":64,"scale_unit":"fragments","dataset_size":65536,"payload_bytes":16,"curve":"seq-k4-fragmentation","strategy":"alternating"},
    {"id":"seq-k4-fragments-1024","family":"homomorphic-signature","operation":"signature.multi-sequence-k4.fragmented-concatenate-total","scale":1024,"scale_unit":"fragments","dataset_size":65536,"payload_bytes":16,"curve":"seq-k4-fragmentation","strategy":"alternating"}
  ]
}
