{
  "schema": "microfield-publication-benchmark-manifest-v1",
  "campaign_id": "pre-rc-bulk-density-frontier-pilot-v1",
  "profile": "pilot",
  "seed": 13503953896175478913,
  "host_mode": "interactive",
  "minimum_processes": 5,
  "maximum_processes": 5,
  "precision_check_every": 1,
  "warmup_observations": 2,
  "measured_observations": 9,
  "target_observation_ns": 500000,
  "maximum_batch_iterations": 1,
  "bootstrap_resamples": 1000,
  "maximum_relative_ci_half_width": 0.20,
  "cells": [
    { "id": "st-r-s64m-e12288-sc", "family": "summary-tree", "operation": "summary-tree.rebuild-batch-total", "scale": 12288, "dataset_size": 67108864, "payload_bytes": 16, "scale_unit": "disjoint-edits", "curve": "st-s64m-frontier-scattered", "strategy": "rebuild-scattered" },
    { "id": "st-b-s64m-e12288-sc", "family": "summary-tree", "operation": "summary-tree.bulk-batch-total", "scale": 12288, "dataset_size": 67108864, "payload_bytes": 16, "scale_unit": "disjoint-edits", "baseline_cell": "st-r-s64m-e12288-sc", "curve": "st-s64m-frontier-scattered", "strategy": "bulk-scattered" },
    { "id": "st-a-s64m-e12288-sc", "family": "summary-tree", "operation": "summary-tree.adaptive-batch-total", "scale": 12288, "dataset_size": 67108864, "payload_bytes": 16, "scale_unit": "disjoint-edits", "baseline_cell": "st-r-s64m-e12288-sc", "curve": "st-s64m-frontier-scattered", "strategy": "adaptive-scattered" },
    { "id": "st-r-s64m-e12288-cl", "family": "summary-tree", "operation": "summary-tree.rebuild-batch-total", "scale": 12288, "dataset_size": 67108864, "payload_bytes": 16, "scale_unit": "disjoint-edits", "curve": "st-s64m-frontier-clustered", "strategy": "rebuild-clustered" },
    { "id": "st-b-s64m-e12288-cl", "family": "summary-tree", "operation": "summary-tree.bulk-batch-total", "scale": 12288, "dataset_size": 67108864, "payload_bytes": 16, "scale_unit": "disjoint-edits", "baseline_cell": "st-r-s64m-e12288-cl", "curve": "st-s64m-frontier-clustered", "strategy": "bulk-clustered" },
    { "id": "st-a-s64m-e12288-cl", "family": "summary-tree", "operation": "summary-tree.adaptive-batch-total", "scale": 12288, "dataset_size": 67108864, "payload_bytes": 16, "scale_unit": "disjoint-edits", "baseline_cell": "st-r-s64m-e12288-cl", "curve": "st-s64m-frontier-clustered", "strategy": "adaptive-clustered" },
    { "id": "st-r-s64m-e16384", "family": "summary-tree", "operation": "summary-tree.rebuild-batch-total", "scale": 16384, "dataset_size": 67108864, "payload_bytes": 16, "scale_unit": "disjoint-edits", "curve": "st-s64m-frontier-full", "strategy": "rebuild-scattered" },
    { "id": "st-b-s64m-e16384", "family": "summary-tree", "operation": "summary-tree.bulk-batch-total", "scale": 16384, "dataset_size": 67108864, "payload_bytes": 16, "scale_unit": "disjoint-edits", "baseline_cell": "st-r-s64m-e16384", "curve": "st-s64m-frontier-full", "strategy": "bulk-scattered" },
    { "id": "st-a-s64m-e16384", "family": "summary-tree", "operation": "summary-tree.adaptive-batch-total", "scale": 16384, "dataset_size": 67108864, "payload_bytes": 16, "scale_unit": "disjoint-edits", "baseline_cell": "st-r-s64m-e16384", "curve": "st-s64m-frontier-full", "strategy": "adaptive-scattered" },

    { "id": "db-r-s65536-m49152-sc", "family": "database", "operation": "database.selected-rebuild-total", "scale": 49152, "dataset_size": 65536, "scale_unit": "row-mutations", "curve": "db-s65536-frontier-scattered", "strategy": "rebuild-scattered" },
    { "id": "db-b-s65536-m49152-sc", "family": "database", "operation": "database.bulk-transaction-total", "scale": 49152, "dataset_size": 65536, "scale_unit": "row-mutations", "baseline_cell": "db-r-s65536-m49152-sc", "curve": "db-s65536-frontier-scattered", "strategy": "bulk-scattered" },
    { "id": "db-a-s65536-m49152-sc", "family": "database", "operation": "database.adaptive-transaction-total", "scale": 49152, "dataset_size": 65536, "scale_unit": "row-mutations", "baseline_cell": "db-r-s65536-m49152-sc", "curve": "db-s65536-frontier-scattered", "strategy": "adaptive-scattered" },
    { "id": "db-r-s65536-m49152-cl", "family": "database", "operation": "database.selected-rebuild-total", "scale": 49152, "dataset_size": 65536, "scale_unit": "row-mutations", "curve": "db-s65536-frontier-clustered", "strategy": "rebuild-clustered" },
    { "id": "db-b-s65536-m49152-cl", "family": "database", "operation": "database.bulk-transaction-total", "scale": 49152, "dataset_size": 65536, "scale_unit": "row-mutations", "baseline_cell": "db-r-s65536-m49152-cl", "curve": "db-s65536-frontier-clustered", "strategy": "bulk-clustered" },
    { "id": "db-a-s65536-m49152-cl", "family": "database", "operation": "database.adaptive-transaction-total", "scale": 49152, "dataset_size": 65536, "scale_unit": "row-mutations", "baseline_cell": "db-r-s65536-m49152-cl", "curve": "db-s65536-frontier-clustered", "strategy": "adaptive-clustered" },
    { "id": "db-r-s65536-m65536", "family": "database", "operation": "database.selected-rebuild-total", "scale": 65536, "dataset_size": 65536, "scale_unit": "row-mutations", "curve": "db-s65536-frontier-full", "strategy": "rebuild-scattered" },
    { "id": "db-b-s65536-m65536", "family": "database", "operation": "database.bulk-transaction-total", "scale": 65536, "dataset_size": 65536, "scale_unit": "row-mutations", "baseline_cell": "db-r-s65536-m65536", "curve": "db-s65536-frontier-full", "strategy": "bulk-scattered" },
    { "id": "db-a-s65536-m65536", "family": "database", "operation": "database.adaptive-transaction-total", "scale": 65536, "dataset_size": 65536, "scale_unit": "row-mutations", "baseline_cell": "db-r-s65536-m65536", "curve": "db-s65536-frontier-full", "strategy": "adaptive-scattered" }
  ]
}
